_id,slug,type,visibility,orphan,title,header,main,rank,aposDocId,path,level,aposLocale,aposMode,metaType,createdAt,archived,titleSortified,updatedAt,cacheInvalidatedAt,updatedBy,highSearchText,highSearchWords,lowSearchText,searchSummary,modified,lastPublishedAt,historicUrls,advisoryLock,relatedReverseIds,contents,thankYouHeading,thankYouBody,sendConfirmationEmail,emailConfirmationField,onSubmitSuccess,submitLabel,enableRecaptcha,enableQueryParams,queryParamList,enablePostmark,postmarkApiKey,fromEmail,toEmail,enableSpreadsheet,spreadsheetId,serviceAccountEmail,serviceAccountPrivateKey,parkedId,parked
xqwna66rhs51rxfmiu5g83zo:en:draft,/let-s-talk,default-page,public,false,Let's talk,"{""_id"":""mtt2u82i7qcunva3m8p2i7n7"",""items"":[],""metaType"":""area""}","{""_id"":""g60hh07nmk6ttyq0rsmyrwfh"",""items"":[{""label"":"""",""title"":""LET’S TALK"",""description"":"""",""_id"":""r4745ivfaxd3yhjq37iamf9r"",""metaType"":""widget"",""type"":""page-intro"",""aposPlaceholder"":false},{""label"":"""",""title"":""We’d love to hear what you’re building"",""description"":""Or what’s not working. Or where you’re stuck. We’re here for all of it."",""_id"":""aes22ack0g89975r9e2vrmrj"",""metaType"":""widget"",""type"":""page-intro"",""aposPlaceholder"":false},{""_id"":""jo9ai5lm4p6ffvexf4muyb5n"",""metaType"":""widget"",""type"":""@apostrophecms/rich-text"",""aposPlaceholder"":false,""content"":""<p><span>We work with teams who are ready to build more aligned systems, stronger partnerships, and software that can hold real complexity.</span></p><p><span>If that sounds like you — or you’re curious what that kind of partnership could look like — let’s talk.</span></p><p><br></p>"",""permalinkIds"":[],""imageIds"":[]},{""form"":{""_id"":""rjjs8cm6yk0bi7v7uy6x9edv"",""items"":[{""_id"":""b2ntht9rb8aff894uj9fsare"",""metaType"":""widget"",""type"":""@apostrophecms/form"",""aposPlaceholder"":false,""formIds"":[""j7cnb0e0l4lqvtn8gr7btl7w""],""formFields"":{""j7cnb0e0l4lqvtn8gr7btl7w"":{}}}],""metaType"":""area""},""_id"":""ty9go9z8u6tgivck2wsa5j1n"",""metaType"":""widget"",""type"":""contact"",""aposPlaceholder"":false},{""form"":{""_id"":""w9srlq89n1yu710qbfequmn9"",""items"":[{""_id"":""s8ckd9v9qfre9b4ggvp0e3tm"",""metaType"":""widget"",""type"":""@apostrophecms/form"",""aposPlaceholder"":false,""formIds"":[""ct0zn9d9jij7cfl6jzoqvx9f""],""formFields"":{""ct0zn9d9jij7cfl6jzoqvx9f"":{}}}],""metaType"":""area""},""_id"":""dceo3i0f79sd52j8z7keztxn"",""metaType"":""widget"",""type"":""contact"",""aposPlaceholder"":false}],""metaType"":""area""}",9,xqwna66rhs51rxfmiu5g83zo,clt4cxwou0005g5kqdtxxb89u/xqwna66rhs51rxfmiu5g83zo,1,en:draft,draft,doc,2025-04-27T12:07:47.019Z,false,let s talk,2025-04-29T18:48:56.232Z,2025-04-29T18:48:56.232Z,"{""_id"":""d7qblajcykk6q37j5w5xt50f"",""title"":""editor"",""username"":""editor""}",let s talk let s talk let s talk default page public let s talk let s talk we d love to hear what you re building or what s not working or where you re stuck we re here for all of it,"[""let"",""s"",""talk"",""default"",""page"",""public"",""we"",""d"",""love"",""to"",""hear"",""what"",""you"",""re"",""building"",""or"",""not"",""working"",""where"",""stuck"",""here"",""for"",""all"",""of"",""it""]",let s talk let s talk let s talk default page public let s talk let s talk we d love to hear what you re building or what s not working or where you re stuck we re here for all of it we work with teams who are ready to build more aligned systems stronger partnerships and software that can hold real complexity if that sounds like you or you re curious what that kind of partnership could look like let s talk,"
We work with teams who are ready to build more aligned systems, stronger partnerships, and software that can hold real complexity.
If that sounds like you — or you’re curious what that kind of partnership could look like — let’s talk.

",false,2025-04-29T18:48:59.856Z,"[""/let-s-talk""]","{""username"":""editor"",""title"":""editor"",""_id"":""dxezz9402o0j62ztbffsylb8"",""updatedAt"":""2025-04-29T18:49:48.478Z""}","[""igio1kxe3ikdh56fid71qzp3""]",,,,,,,,,,,,,,,,,,,,
igio1kxe3ikdh56fid71qzp3:en:draft,/meet-the-team,default-page,public,false,Meet the Team,"{""_id"":""t57bo9j37kgrd9evsswuxa7v"",""items"":[],""metaType"":""area""}","{""_id"":""o5ewl0tn518fu2mk28skl4yj"",""items"":[{""label"":"""",""title"":""Meet who you’ll be building with"",""description"":""Get to know the leaders guiding the work, and the people behind the projects."",""_id"":""gqpbweb1j4soko4dq1kkbb60"",""metaType"":""widget"",""type"":""page-intro"",""aposPlaceholder"":false},{""size"":52,""_id"":""kb1mutr4h9bjmyjppxxe861l"",""metaType"":""widget"",""type"":""whitespace"",""aposPlaceholder"":false},{""intro"":{""_id"":""rx7kkac6lo0ot9yr51mjqbrz"",""items"":[],""metaType"":""area""},""_id"":""fj9gzc25pv7kpapnmbhhainb"",""metaType"":""widget"",""type"":""leadership-carousel"",""aposPlaceholder"":false},{""alignment"":""center"",""buttonCollection"":[{""_id"":""ymhxz8na481a692m5jkfd1jj"",""metaType"":""arrayItem"",""scopedArrayName"":""widget.buttons.buttonCollection"",""button"":{""_id"":""etjr3djzv2m1mrycc46vrjlt"",""linkTitle"":""Ready to meet us for real?"",""linkType"":""page"",""customUrl"":null,""target"":[],""metaType"":""object"",""scopedObjectName"":""widget.buttons.button"",""pageIds"":[""xqwna66rhs51rxfmiu5g83zo""],""pageFields"":{""xqwna66rhs51rxfmiu5g83zo"":{}},""fileIds"":[],""fileFields"":{}},""buttonConfig"":{""_id"":""g44j4x1n80mtknqoq9cpc1q8"",""buttonStyle"":""btn-dark"",""metaType"":""object"",""scopedObjectName"":""widget.buttons.buttonConfig""}}],""_id"":""o3n4gpcvjfmzrdscg3l1vd7x"",""metaType"":""widget"",""type"":""buttons"",""aposPlaceholder"":false},{""size"":52,""_id"":""m0z0re3xk0x963pp6rcti5xk"",""metaType"":""widget"",""type"":""whitespace"",""aposPlaceholder"":false}],""metaType"":""area""}",16,igio1kxe3ikdh56fid71qzp3,clt4cxwou0005g5kqdtxxb89u/igio1kxe3ikdh56fid71qzp3,1,en:draft,draft,doc,2025-04-29T15:22:33.620Z,false,meet the team,2025-04-29T18:44:00.838Z,2025-04-29T18:48:56.232Z,"{""_id"":""d7qblajcykk6q37j5w5xt50f"",""title"":""editor"",""username"":""editor""}",meet the team meet the team meet the team default page public meet the team meet who you ll be building with get to know the leaders guiding the work and the people behind the projects center ready to meet us for real page btn dark,"[""meet"",""the"",""team"",""default"",""page"",""public"",""who"",""you"",""ll"",""be"",""building"",""with"",""get"",""to"",""know"",""leaders"",""guiding"",""work"",""and"",""people"",""behind"",""projects"",""center"",""ready"",""us"",""for"",""real"",""btn"",""dark""]",meet the team meet the team meet the team default page public meet the team meet who you ll be building with get to know the leaders guiding the work and the people behind the projects center ready to meet us for real page btn dark,,false,2025-04-29T18:44:01.853Z,"[""/meet-the-team""]","{""username"":""editor"",""title"":""editor"",""_id"":""dxezz9402o0j62ztbffsylb8"",""updatedAt"":""2025-04-29T18:44:20.317Z""}",,,,,,,,,,,,,,,,,,,,,
j7cnb0e0l4lqvtn8gr7btl7w:en:draft,let-s-talk,@apostrophecms/form,public,,Let’s Talk,,,,j7cnb0e0l4lqvtn8gr7btl7w,,,en:draft,draft,doc,2024-11-05T07:42:13.791Z,false,let s talk,2025-04-29T18:46:25.285Z,2025-04-29T18:48:56.232Z,"{""_id"":""d7qblajcykk6q37j5w5xt50f"",""title"":""editor"",""username"":""editor""}",let s talk let s talk let s talk name name text email address email address text company organization company organization text role title role title text what are you hoping to build or solve what are you hoping to build or solve anything else you d like us to know anything else you d like us to know let s talk public your future starts now send,"[""let"",""s"",""talk"",""name"",""text"",""email"",""address"",""company"",""organization"",""role"",""title"",""what"",""are"",""you"",""hoping"",""to"",""build"",""or"",""solve"",""anything"",""else"",""d"",""like"",""us"",""know"",""public"",""your"",""future"",""starts"",""now"",""send""]",let s talk let s talk let s talk name name text email address email address text company organization company organization text role title role title text what are you hoping to build or solve what are you hoping to build or solve anything else you d like us to know anything else you d like us to know let s talk public your future starts now we ll be in touch by email within 24 hours meanwhile feel free to explore more about our future collaboration send,"
We’ll be in touch by email within 24 hours. Meanwhile, feel free to explore more about our future collaboration.",false,2025-04-29T18:46:25.312Z,,,"[""clt4cxwou0005g5kqdtxxb89u"",""xqwna66rhs51rxfmiu5g83zo""]","{""_id"":""i920aj730e1p4h5ymfbg74wx"",""items"":[{""fieldLabel"":""Name*"",""required"":true,""fieldName"":""name"",""inputType"":""text"",""placeholder"":"""",""_id"":""vfi9qspnpox47ouh5svi8zz5"",""metaType"":""widget"",""type"":""@apostrophecms/form-text-field"",""aposPlaceholder"":false},{""fieldLabel"":""Email Address*"",""required"":true,""fieldName"":""email-address"",""inputType"":""text"",""placeholder"":"""",""_id"":""o7e4accnt6z352rpjsdxp33c"",""metaType"":""widget"",""type"":""@apostrophecms/form-text-field"",""aposPlaceholder"":false},{""fieldLabel"":""Company / Organization"",""required"":false,""fieldName"":""company-organization"",""inputType"":""text"",""placeholder"":"""",""_id"":""eopowhmka5zgxyjwouxemjga"",""metaType"":""widget"",""type"":""@apostrophecms/form-text-field"",""aposPlaceholder"":false},{""fieldLabel"":""Role / Title"",""required"":false,""fieldName"":""role-title"",""inputType"":""text"",""placeholder"":"""",""_id"":""b0p8kqtre4907w408gqwuury"",""metaType"":""widget"",""type"":""@apostrophecms/form-text-field"",""aposPlaceholder"":false},{""fieldLabel"":""What are you hoping to build or solve?*"",""required"":true,""fieldName"":""what-are-you-hoping-to-build-or-solve"",""placeholder"":"""",""_id"":""x7harm3gb4nafbbz2g6mlwvp"",""metaType"":""widget"",""type"":""@apostrophecms/form-textarea-field"",""aposPlaceholder"":false},{""fieldLabel"":""Anything else you'd like us to know?"",""required"":false,""fieldName"":""anything-else-you-d-like-us-to-know"",""placeholder"":"""",""_id"":""j374yii29d9hgynnl5y9gt56"",""metaType"":""widget"",""type"":""@apostrophecms/form-textarea-field"",""aposPlaceholder"":false}],""metaType"":""area""}",Your future starts now,"{""_id"":""aeemlt1auyvesemdyyr954jv"",""items"":[{""_id"":""u3u6oy3fp647ekhycnodskxn"",""metaType"":""widget"",""type"":""@apostrophecms/rich-text"",""aposPlaceholder"":false,""content"":""<p>We’ll be in touch by email within 24 hours. Meanwhile, feel free to explore more about our future collaboration.</p>"",""permalinkIds"":[],""imageIds"":[]}],""metaType"":""area""}",false,,,Send,false,false,[],false,,,,false,,,,,
ct0zn9d9jij7cfl6jzoqvx9f:en:draft,support-inquiry-form,@apostrophecms/form,public,,Support Inquiry Form,,,,ct0zn9d9jij7cfl6jzoqvx9f,,,en:draft,draft,doc,2025-04-27T12:24:06.717Z,false,support inquiry form,2025-04-28T14:50:14.364Z,2025-04-29T18:48:56.232Z,"{""_id"":""d7qblajcykk6q37j5w5xt50f"",""title"":""editor"",""username"":""editor""}",support inquiry form support inquiry form support inquiry form how did you hear about us how did you hear about us what kind of support are you looking for what kind of support are you looking for full build new product full build new product staff augmentation staff augmentation long term partnership long term partnership discovery or consultation discovery or consultation not sure yet not sure yet support inquiry form public,"[""support"",""inquiry"",""form"",""how"",""did"",""you"",""hear"",""about"",""us"",""what"",""kind"",""of"",""are"",""looking"",""for"",""full"",""build"",""new"",""product"",""staff"",""augmentation"",""long"",""term"",""partnership"",""discovery"",""or"",""consultation"",""not"",""sure"",""yet"",""public""]",support inquiry form support inquiry form support inquiry form how did you hear about us how did you hear about us what kind of support are you looking for what kind of support are you looking for full build new product full build new product staff augmentation staff augmentation long term partnership long term partnership discovery or consultation discovery or consultation not sure yet not sure yet support inquiry form public,,false,2025-04-28T14:50:14.442Z,,"{""username"":""editor"",""title"":""editor"",""_id"":""vk8kpcpvm3ou5jxlrhtn7qmf"",""updatedAt"":""2025-04-28T17:16:24.402Z""}","[""xqwna66rhs51rxfmiu5g83zo""]","{""_id"":""y3w0vyuj2hmznvzn669natdt"",""items"":[{""fieldLabel"":""How did you hear about us?"",""required"":false,""fieldName"":""how-did-you-hear-about-us"",""placeholder"":"""",""_id"":""u71k7s5elzuhwtw95ue5h742"",""metaType"":""widget"",""type"":""@apostrophecms/form-textarea-field"",""aposPlaceholder"":false},{""fieldLabel"":""What kind of support are you looking for?"",""required"":true,""fieldName"":""what-kind-of-support-are-you-looking-for"",""choices"":[{""_id"":""ugprr6eouwf96se9up3xpncz"",""metaType"":""arrayItem"",""scopedArrayName"":""widget.@apostrophecms/form-checkboxes-field.choices"",""label"":""Full build / new product"",""value"":""Full build / new product""},{""_id"":""ucfg6spjet16d4tnjiv2w2lx"",""metaType"":""arrayItem"",""scopedArrayName"":""widget.@apostrophecms/form-checkboxes-field.choices"",""label"":""Staff augmentation"",""value"":""Staff augmentation""},{""_id"":""ggz5kzycxvbltph06im87xgt"",""metaType"":""arrayItem"",""scopedArrayName"":""widget.@apostrophecms/form-checkboxes-field.choices"",""label"":""Long-term partnership"",""value"":""Long-term partnership""},{""_id"":""xnuxf3b8egfsiaok2stlnn1r"",""metaType"":""arrayItem"",""scopedArrayName"":""widget.@apostrophecms/form-checkboxes-field.choices"",""label"":""Discovery or consultation"",""value"":""Discovery or consultation""},{""_id"":""zyd879ecn0xjbpbnhz9smwjd"",""metaType"":""arrayItem"",""scopedArrayName"":""widget.@apostrophecms/form-checkboxes-field.choices"",""label"":""Not sure yet"",""value"":""Not sure yet""}],""_id"":""mpfub3z1a1s2gddzsm5vhpml"",""metaType"":""widget"",""type"":""@apostrophecms/form-checkboxes-field"",""aposPlaceholder"":false}],""metaType"":""area""}",,"{""_id"":""yinmnhy88cah8bl6sa11dkjb"",""items"":[],""metaType"":""area""}",false,,,,false,false,[],,,,,,,,,,
xqwna66rhs51rxfmiu5g83zo:en:published,/let-s-talk,default-page,public,false,Let's talk,"{""_id"":""mtt2u82i7qcunva3m8p2i7n7"",""items"":[],""metaType"":""area""}","{""_id"":""g60hh07nmk6ttyq0rsmyrwfh"",""items"":[{""label"":"""",""title"":""LET’S TALK"",""description"":"""",""_id"":""r4745ivfaxd3yhjq37iamf9r"",""metaType"":""widget"",""type"":""page-intro"",""aposPlaceholder"":false},{""label"":"""",""title"":""We’d love to hear what you’re building"",""description"":""Or what’s not working. Or where you’re stuck. We’re here for all of it."",""_id"":""aes22ack0g89975r9e2vrmrj"",""metaType"":""widget"",""type"":""page-intro"",""aposPlaceholder"":false},{""_id"":""jo9ai5lm4p6ffvexf4muyb5n"",""metaType"":""widget"",""type"":""@apostrophecms/rich-text"",""aposPlaceholder"":false,""content"":""<p><span>We work with teams who are ready to build more aligned systems, stronger partnerships, and software that can hold real complexity.</span></p><p><span>If that sounds like you — or you’re curious what that kind of partnership could look like — let’s talk.</span></p><p><br></p>"",""permalinkIds"":[],""imageIds"":[]},{""form"":{""_id"":""rjjs8cm6yk0bi7v7uy6x9edv"",""items"":[{""_id"":""b2ntht9rb8aff894uj9fsare"",""metaType"":""widget"",""type"":""@apostrophecms/form"",""aposPlaceholder"":false,""formIds"":[""j7cnb0e0l4lqvtn8gr7btl7w""],""formFields"":{""j7cnb0e0l4lqvtn8gr7btl7w"":{}}}],""metaType"":""area""},""_id"":""ty9go9z8u6tgivck2wsa5j1n"",""metaType"":""widget"",""type"":""contact"",""aposPlaceholder"":false},{""form"":{""_id"":""w9srlq89n1yu710qbfequmn9"",""items"":[{""_id"":""s8ckd9v9qfre9b4ggvp0e3tm"",""metaType"":""widget"",""type"":""@apostrophecms/form"",""aposPlaceholder"":false,""formIds"":[""ct0zn9d9jij7cfl6jzoqvx9f""],""formFields"":{""ct0zn9d9jij7cfl6jzoqvx9f"":{}}}],""metaType"":""area""},""_id"":""dceo3i0f79sd52j8z7keztxn"",""metaType"":""widget"",""type"":""contact"",""aposPlaceholder"":false}],""metaType"":""area""}",13,xqwna66rhs51rxfmiu5g83zo,clt4cxwou0005g5kqdtxxb89u/xqwna66rhs51rxfmiu5g83zo,1,en:published,published,doc,2025-04-27T12:07:47.075Z,false,let s talk,2025-04-29T18:48:59.864Z,2025-04-29T18:48:59.864Z,"{""_id"":""d7qblajcykk6q37j5w5xt50f"",""title"":""editor"",""username"":""editor""}",let s talk let s talk let s talk default page public let s talk let s talk we d love to hear what you re building or what s not working or where you re stuck we re here for all of it,"[""let"",""s"",""talk"",""default"",""page"",""public"",""we"",""d"",""love"",""to"",""hear"",""what"",""you"",""re"",""building"",""or"",""not"",""working"",""where"",""stuck"",""here"",""for"",""all"",""of"",""it""]",let s talk let s talk let s talk default page public let s talk let s talk we d love to hear what you re building or what s not working or where you re stuck we re here for all of it we work with teams who are ready to build more aligned systems stronger partnerships and software that can hold real complexity if that sounds like you or you re curious what that kind of partnership could look like let s talk,"
We work with teams who are ready to build more aligned systems, stronger partnerships, and software that can hold real complexity.
If that sounds like you — or you’re curious what that kind of partnership could look like — let’s talk.

",,2025-04-29T18:48:59.856Z,"[""/let-s-talk""]",,"[""igio1kxe3ikdh56fid71qzp3""]",,,,,,,,,,,,,,,,,,,,
igio1kxe3ikdh56fid71qzp3:en:published,/meet-the-team,default-page,public,false,Meet the Team,"{""_id"":""t57bo9j37kgrd9evsswuxa7v"",""items"":[],""metaType"":""area""}","{""_id"":""o5ewl0tn518fu2mk28skl4yj"",""items"":[{""label"":"""",""title"":""Meet who you’ll be building with"",""description"":""Get to know the leaders guiding the work, and the people behind the projects."",""_id"":""gqpbweb1j4soko4dq1kkbb60"",""metaType"":""widget"",""type"":""page-intro"",""aposPlaceholder"":false},{""size"":52,""_id"":""kb1mutr4h9bjmyjppxxe861l"",""metaType"":""widget"",""type"":""whitespace"",""aposPlaceholder"":false},{""intro"":{""_id"":""rx7kkac6lo0ot9yr51mjqbrz"",""items"":[],""metaType"":""area""},""_id"":""fj9gzc25pv7kpapnmbhhainb"",""metaType"":""widget"",""type"":""leadership-carousel"",""aposPlaceholder"":false},{""alignment"":""center"",""buttonCollection"":[{""_id"":""ymhxz8na481a692m5jkfd1jj"",""metaType"":""arrayItem"",""scopedArrayName"":""widget.buttons.buttonCollection"",""button"":{""_id"":""etjr3djzv2m1mrycc46vrjlt"",""linkTitle"":""Ready to meet us for real?"",""linkType"":""page"",""customUrl"":null,""target"":[],""metaType"":""object"",""scopedObjectName"":""widget.buttons.button"",""pageIds"":[""xqwna66rhs51rxfmiu5g83zo""],""pageFields"":{""xqwna66rhs51rxfmiu5g83zo"":{}},""fileIds"":[],""fileFields"":{}},""buttonConfig"":{""_id"":""g44j4x1n80mtknqoq9cpc1q8"",""buttonStyle"":""btn-dark"",""metaType"":""object"",""scopedObjectName"":""widget.buttons.buttonConfig""}}],""_id"":""o3n4gpcvjfmzrdscg3l1vd7x"",""metaType"":""widget"",""type"":""buttons"",""aposPlaceholder"":false},{""size"":52,""_id"":""m0z0re3xk0x963pp6rcti5xk"",""metaType"":""widget"",""type"":""whitespace"",""aposPlaceholder"":false}],""metaType"":""area""}",15,igio1kxe3ikdh56fid71qzp3,clt4cxwou0005g5kqdtxxb89u/igio1kxe3ikdh56fid71qzp3,1,en:published,published,doc,2025-04-29T15:22:33.666Z,false,meet the team,2025-04-29T18:44:01.863Z,2025-04-29T18:48:59.864Z,"{""_id"":""d7qblajcykk6q37j5w5xt50f"",""title"":""editor"",""username"":""editor""}",meet the team meet the team meet the team default page public meet the team meet who you ll be building with get to know the leaders guiding the work and the people behind the projects center ready to meet us for real page btn dark,"[""meet"",""the"",""team"",""default"",""page"",""public"",""who"",""you"",""ll"",""be"",""building"",""with"",""get"",""to"",""know"",""leaders"",""guiding"",""work"",""and"",""people"",""behind"",""projects"",""center"",""ready"",""us"",""for"",""real"",""btn"",""dark""]",meet the team meet the team meet the team default page public meet the team meet who you ll be building with get to know the leaders guiding the work and the people behind the projects center ready to meet us for real page btn dark,,,2025-04-29T18:44:01.853Z,"[""/meet-the-team""]",,,,,,,,,,,,,,,,,,,,,,
j7cnb0e0l4lqvtn8gr7btl7w:en:published,let-s-talk,@apostrophecms/form,public,,Let’s Talk,,,,j7cnb0e0l4lqvtn8gr7btl7w,,,en:published,published,doc,2024-11-05T07:42:14.080Z,false,let s talk,2025-04-29T18:46:25.319Z,2025-04-29T18:48:59.864Z,"{""_id"":""d7qblajcykk6q37j5w5xt50f"",""title"":""editor"",""username"":""editor""}",let s talk let s talk let s talk name name text email address email address text company organization company organization text role title role title text what are you hoping to build or solve what are you hoping to build or solve anything else you d like us to know anything else you d like us to know let s talk public your future starts now send,"[""let"",""s"",""talk"",""name"",""text"",""email"",""address"",""company"",""organization"",""role"",""title"",""what"",""are"",""you"",""hoping"",""to"",""build"",""or"",""solve"",""anything"",""else"",""d"",""like"",""us"",""know"",""public"",""your"",""future"",""starts"",""now"",""send""]",let s talk let s talk let s talk name name text email address email address text company organization company organization text role title role title text what are you hoping to build or solve what are you hoping to build or solve anything else you d like us to know anything else you d like us to know let s talk public your future starts now we ll be in touch by email within 24 hours meanwhile feel free to explore more about our future collaboration send,"
We’ll be in touch by email within 24 hours. Meanwhile, feel free to explore more about our future collaboration.",,2025-04-29T18:46:25.312Z,,,"[""clt4cxwou0005g5kqdtxxb89u"",""xqwna66rhs51rxfmiu5g83zo""]","{""_id"":""i920aj730e1p4h5ymfbg74wx"",""items"":[{""fieldLabel"":""Name*"",""required"":true,""fieldName"":""name"",""inputType"":""text"",""placeholder"":"""",""_id"":""vfi9qspnpox47ouh5svi8zz5"",""metaType"":""widget"",""type"":""@apostrophecms/form-text-field"",""aposPlaceholder"":false},{""fieldLabel"":""Email Address*"",""required"":true,""fieldName"":""email-address"",""inputType"":""text"",""placeholder"":"""",""_id"":""o7e4accnt6z352rpjsdxp33c"",""metaType"":""widget"",""type"":""@apostrophecms/form-text-field"",""aposPlaceholder"":false},{""fieldLabel"":""Company / Organization"",""required"":false,""fieldName"":""company-organization"",""inputType"":""text"",""placeholder"":"""",""_id"":""eopowhmka5zgxyjwouxemjga"",""metaType"":""widget"",""type"":""@apostrophecms/form-text-field"",""aposPlaceholder"":false},{""fieldLabel"":""Role / Title"",""required"":false,""fieldName"":""role-title"",""inputType"":""text"",""placeholder"":"""",""_id"":""b0p8kqtre4907w408gqwuury"",""metaType"":""widget"",""type"":""@apostrophecms/form-text-field"",""aposPlaceholder"":false},{""fieldLabel"":""What are you hoping to build or solve?*"",""required"":true,""fieldName"":""what-are-you-hoping-to-build-or-solve"",""placeholder"":"""",""_id"":""x7harm3gb4nafbbz2g6mlwvp"",""metaType"":""widget"",""type"":""@apostrophecms/form-textarea-field"",""aposPlaceholder"":false},{""fieldLabel"":""Anything else you'd like us to know?"",""required"":false,""fieldName"":""anything-else-you-d-like-us-to-know"",""placeholder"":"""",""_id"":""j374yii29d9hgynnl5y9gt56"",""metaType"":""widget"",""type"":""@apostrophecms/form-textarea-field"",""aposPlaceholder"":false}],""metaType"":""area""}",Your future starts now,"{""_id"":""aeemlt1auyvesemdyyr954jv"",""items"":[{""_id"":""u3u6oy3fp647ekhycnodskxn"",""metaType"":""widget"",""type"":""@apostrophecms/rich-text"",""aposPlaceholder"":false,""content"":""<p>We’ll be in touch by email within 24 hours. Meanwhile, feel free to explore more about our future collaboration.</p>"",""permalinkIds"":[],""imageIds"":[]}],""metaType"":""area""}",false,,,Send,false,false,[],false,,,,false,,,,,
